<?xml version="1.0" encoding="UTF-8" standalone="no"?>
<!DOCTYPE tv_data SYSTEM "TVListings.dtd">
<tv_data>
  <listings_date date="15/01/2011">
    <channel_data name="BBC1" channel_id="4" start_time="2011-01-15T06:00:00+00:00" end_time="2011-01-16T06:00:00+00:00">
      <epgdetails>
        <epg provider_id ="6" provider_name="Virgin TV (Telewest)" channel_number="101"/>
        <epg provider_id ="11" provider_name="Sky NI" channel_number="101"/>
        <epg provider_id ="7" provider_name="Freeview Wales" channel_number="1"/>
        <epg provider_id ="2" provider_name="Virgin TV (NTL)" channel_number="101"/>
        <epg provider_id ="12" provider_name="Freesat" channel_number="101"/>
        <epg provider_id ="8" provider_name="NTL Ireland Digital" channel_number="108"/>
        <epg provider_id ="1" provider_name="Sky" channel_number="101"/>
        <epg provider_id ="4" provider_name="Freeview" channel_number="1"/>
        <epg provider_id ="10" provider_name="Sky Wales" channel_number="101"/>
        <epg provider_id ="5" provider_name="Topup" channel_number="1"/>
      </epgdetails>
      <prog_data>
        <showing_id>71118471</showing_id>
        <prog_id>1424497</prog_id>
        <series_id>122139</series_id>
          <date>15/01/2011</date>
        <time>21:40</time>
        <duration>30</duration>
        <title>Come Fly with Me</title>
        <episode_number>2</episode_number>
        <episode_total>6</episode_total>
        <series_number>1</series_number>
        <category><category_name>Comedy</category_name><category_code>1400</category_code></category>
        <rt_category><maincat>Comedy</maincat></rt_category>
        <cast_member>
            <character>Various characters</character>
            <actor person_id="1">Matt Lucas</actor>
        </cast_member>
        <cast_member>
            <character>Various characters</character>
            <actor person_id="2">David Walliams</actor>
        </cast_member>
        <cast_member>
            <character>Holly&apos;s mother</character>
            <actor person_id="3">Rebecca Humphries</actor>
        </cast_member>
        <cast_member>
            <character>Mrs Talbot</character>
            <actor person_id="4">Di Botcher</actor>
        </cast_member>
        <cast_member>
            <character>Posh lady</character>
            <actor person_id="5">Louisa Rix</actor>
        </cast_member>
        <cast_member>
            <character>African lady</character>
            <actor person_id="6">Ellen Thomas</actor>
        </cast_member>
        <cast_member>
            <character>Happy Burger customer</character>
            <actor person_id="7">Paul Putner</actor>
        </cast_member>
        <cast_member>
            <character>Drunk pilot</character>
            <actor person_id="8">Ted Robbins</actor>
        </cast_member>
        <cast_member>
            <character>Duty free passsenger</character>
            <actor person_id="9">Liz Sutherland</actor>
        </cast_member>
        <cast_member>
            <character>Passenger</character>
            <actor person_id="10">Laurence Howarth</actor>
        </cast_member>
        <cast_member>
            <character>Hand luggage woman</character>
            <actor person_id="11">Claire Vousden</actor>
        </cast_member>
        <cast_member>
            <character>Nervous passenger</character>
            <actor person_id="12">Selina Griffiths</actor>
        </cast_member>
        <cast_member>
            <character>Elderly man</character>
            <actor person_id="13">Freddie Lees</actor>
        </cast_member>
        <cast_member>
            <character>FlyLo employee</character>
            <actor person_id="14">Pippa Bennett-Warner</actor>
        </cast_member>
        <staff_member>
          <role>Director</role>
          <person person_id="15">Paul King</person>
        </staff_member>
        <staff_member>
          <role>Producer</role>
          <person person_id="16">Adam Tandy</person>
        </staff_member>
        <staff_member>
          <role>Writer</role>
          <person person_id="17">Matt Lucas</person>
        </staff_member>
        <billings>
          <billing type="synopsis">FlyLo passengers are delayed on a journey to Malaga when there is a wing malfunction on their flight, while Melody and Taaj get tough with the airline&apos;s new baggage allowance policy. Pete and Judith explain what went wrong on their cruise, and there is an introduction to Happy Burger&apos;s newest employee and pilot-to-be Tommy. Comedy, with Matt Lucas and David Walliams.</billing>
          <billing type="pa_detail1">A wing malfunction delays passengers.</billing>
          <billing type="pa_detail2">FlyLo passengers are delayed on a journey to Malaga when there is a wing malfunction on their flight, while Melody and Taaj get tough with the new baggage allowance policy.</billing>
          <billing type="pa_detail3">FlyLo passengers are delayed on a journey to Malaga when there is a wing malfunction on their flight, while Melody and Taaj get tough with the airline&apos;s new baggage allowance policy. Pete and Judith explain what went wrong on their cruise, and there is an introduction to Happy Burger&apos;s newest employee and pilot-to-be Tommy. Comedy, with Matt Lucas and David Walliams.</billing>
        </billings>
<videoplus>399370</videoplus><attr stereo="no" subtitles="yes" repeat="yes" bw="no" premiere="no" new_series="no" last_in_series="no" surround="no" widescreen="yes" film="no" sign_lang="no" in_vision="no" audio_des="yes" interactive="no" hd="yes" live="no" as_live="no" follow_on="no" choice="no" familychoice="no" tv_movie="no" web_choice="no" three_d="yes"/>
        <pictures>
          <pictureUsage type="season" pictureUsage_id="75455-71118471" copyright="©BBC" start_date="18/12/2010" expiry_date="05/02/2011">webcomeflywithme1.jpg</pictureUsage>
          <pictureUsage type="season" pictureUsage_id="75456-71118471" copyright="©BBC" start_date="18/12/2010" expiry_date="05/02/2011">webcomeflywithme2.jpg</pictureUsage>
        </pictures>
      </prog_data>
    </channel_data>
  </listings_date>
</tv_data>